{
    "WME": {
        "name": "Met. mast",
        "coordinates": {
            "latitude": 53.554582,
            "longitude": 8.622380
        }
    },
    "WTG": {
        "name": "AD5-135 (Lehe-3)",
        "hub-height": 130,
        "rotor-diameter": 135,
        "coordinates": {
            "latitude": 53.550781,
            "longitude": 8.622744
        }
    },
    "WTG-obstacle-set": [
        {
            "name": "AD5-116 (Lehe-1)",
            "hub-height": 110,
            "rotor-diameter": 116,
            "tower-base-diameter": 5,
            "in-operation": true,
            "coordinates": {
                "latitude": 53.561207,
                "longitude": 8.622948
            }
        },
        {
            "name": "AD5-116 (Lehe-2)",
            "hub-height": 110,
            "rotor-diameter": 116,
            "tower-base-diameter": 5,
            "in-operation": false,
            "coordinates": {
                "latitude": 53.556630,
                "longitude": 8.624490
            }
        },
        {
            "name": "Senvion 5M (1)",
            "hub-height": 120,
            "rotor-diameter": 126,
            "tower-base-diameter": 5,
            "in-operation": true,
            "coordinates": {
                "latitude": 53.553858,
                "longitude": 8.631728
            }
        },
        {
            "name": "Senvion 5M (2)",
            "hub-height": 120,
            "rotor-diameter": 126,
            "tower-base-diameter": 5,
            "in-operation": true,
            "coordinates": {
                "latitude": 53.547983,
                "longitude": 8.629427
            }
        },
        {
            "name": "Senvion 5M (3)",
            "hub-height": 120,
            "rotor-diameter": 126,
            "tower-base-diameter": 5,
            "in-operation": true,
            "coordinates": {
                "latitude": 53.545727,
                "longitude": 8.622660
            }
        },
        {
            "name": "Fictional small WTG",
            "hub-height": 20,
            "rotor-diameter": 10,
            "tower-base-diameter": 0.4,
            "in-operation": true,
            "coordinates": {
                "latitude": 53.551357,
                "longitude": 8.627901
            }
        }
    ],
    "other-obstacle-set": [
        {
            "name": "BEG",
            "height": 60,
            "width-wtg": 20,
            "width-wme": 4,
            "coordinates": {
                "latitude": 53.547847,
                "longitude": 8.617918
            }
        }
    ],
    "satellite-map-settings": {
        "source": "Google Maps",
        "zoom-level": 14,
        "scale-factor": 1.29,
        "offset-x": 0,
        "offset-y": 0
    },
    "general-settings": {
        "min-sector-width": 20,
        "min-sector-radius": 1000,
        "excluded-sector-set": [
            {
                "min": 280,
                "max": 290
            }
        ],
        "terrain-height-set": [
            0,
            100,
            200
        ]
    }
}